domain,url,dr,fit_strength,fit_keyword_count,fit_keywords,author_name,article_topic,section_quote,suggested_anchor_text,rationale,word_count
vimeo.com,https://vimeo.com/blog/post/video-content-marketing-strategy,96,strong,,,Cooper Savage,"Video content marketing strategy guide — types of videos, distribution platforms, best practices","AI tools can help generate scripts, edit content, add subtitles, and even translate video for different audiences.",translate video for different audiences,The FAQ section already mentions translating video but has no link to a specific tool. Linking to Synthesia's video translator here gives readers a concrete solution.,
shopify.com,https://www.shopify.com/blog/content-localization,96,strong,,,Charlotte Muzzi,How to create a content localization strategy for international ecommerce growth,"Plain text is the easiest to localize. Images are harder, and media assets like videos or podcasts are the most expensive and difficult.",AI video translator,The article discusses video localization being expensive and difficult. A link to Synthesia's AI video translator would show readers there's now an affordable solution for video localization — directl,
userway.org,https://userway.org/blog/accessible-videos/,92,weak,,,Chris Mays,"Guide to making videos accessible — WCAG standards, ADA compliance, 10 tips",They're also helpful for people watching in noisy environments or who are not native speakers of the video's language.,,"Weak fit. Article focuses on accessibility compliance (captions, audio descriptions), not translation/localization. The mention of non-native speakers is brief and tangential.",
digitalocean.com,https://www.digitalocean.com/resources/articles/ai-animation-video-generator,91,excluded_already_mentioned,,,Jesse Sumrak,Roundup of 15 AI animation video generators in 2026,avatar-based platforms like Synthesia and HeyGen to advanced AI image generation models,video translator,SYNTHESIA MENTIONED: Page already mentions Synthesia but may not link to the video translator page specifically. Pitch adding a direct link to the translator feature. Synthesia is already mentioned in,
activecampaign.com,https://www.activecampaign.com/blog/localized-marketing,91,medium,,,Erin McInrue Savage,6-step blueprint for building localized marketing campaigns across global markets,"Translation is much more than word-swapping. Navigating language nuance, jargon, and slang is a complex business.",video localization tools,"Article covers content localization strategy including messaging and visuals, but only mentions email translation tools. Section 3 (Adapt messaging) or section 4 (Automate cross-channel delivery) coul",
yoast.com,https://yoast.com/hreflang-ultimate-guide/,91,no_fit,,,Joost de Valk,Technical guide to implementing hreflang tags for multilingual websites,,,"No fit. Purely technical SEO guide about hreflang HTML implementation. No discussion of video content, translation tools, or localization workflows.",
neilpatel.com,https://neilpatel.com/blog/how-to-international-seo/,91,weak,,,Neil Patel,"Comprehensive guide to international SEO — targeting global audiences, URL structures, content localization",Just because a keyword works well for you in English doesn't mean you can translate it directly into a foreign language,,"Article discusses content localization for international markets. The 'Tailor Your Content' section could reference video translation as part of adapting content for global audiences. However, Neil Pa",
zapier.com,https://zapier.com/blog/best-ai-video-generator/,91,weak_for_translator,,,Miguel Rebelo,Roundup of 18 best AI video generators in 2026,"From smart video editing software to generative text-to-video apps, there are tools that will help you do whatever you want",,"High-authority listicle of AI video tools. Synthesia may already be listed. If not, it's a natural inclusion. However this is about video GENERATION not translation — the video translator page specifi",
bamboohr.com,https://www.bamboohr.com/blog/compliance-training,90,medium,,,Matthew NeSmith,"What compliance training is, why it matters, and how to build a program","Offering compliance training in multiple languages, with subtitles, ensures that everyone understands the most critical parts of their job.",AI video translation,Medium fit. The 'Accessibility' trend section mentions multilingual training in one sentence. Could pitch expanding it with a reference to AI video translation tools that dub compliance training video,
deepl.com,https://www.deepl.com/en/blog/deepl-articulate-localized-workplace-learning,90,no_fit,,,Phil Dawsey,DeepL + Articulate partnership for localizing workplace e-learning training,it can take months to localize one course into one language,,No fit. Partnership announcement between DeepL and Articulate. They discuss training localization challenges but the article is essentially a product promotion — won't link to a competing video transl,
on24.com,https://www.on24.com/blog/how-to-repurpose-your-webinar-series-content/,90,strong,,,Lauren Teneriello,"Comprehensive guide on repurposing webinar content into blogs, videos, podcasts, courses","If you plan to expand your services globally, you'll need to produce localized content. That means translation. One easy way to localize content is to add closed captions to webinars.",AI video translation tool,Strong fit. The 'Reaching global audiences' section discusses translating webinars but only mentions closed captions. A link to Synthesia's video translator would be a natural addition — AI dubbing go,
articulate.com,https://www.articulate.com/blog/multilingual-onboarding-why-you-need-it-and-how-to-do-it/,88,strong,,,Dolisha Mitchell,Why multilingual onboarding matters and how to implement it — 4 reasons + 4 implementation steps,"Include infographics, videos, and quizzes in onboarding materials to reinforce key concepts. These elements can often transcend language barriers and improve understanding.",translate onboarding videos into multiple languages,Strong fit. Article thoroughly covers multilingual onboarding but focuses on documents and e-learning. The 'Provide visuals and interactive elements' section mentions videos but doesn't address how to,
community.articulate.com,https://community.articulate.com/blog/articles/e-learning-localization-best-practices/1220822,88.0,weak,2,"global audience, translation tool",,E-Learning Localization Best Practices,"ce, no matter what language they speak?  Good news! It’s not too late to adapt your course for your global audience. Use this list of best practices to review and update your course before you transla",,"Weak fit — only 2 relevant keyword(s): global audience, translation tool.",1182
learnworlds.com,https://www.learnworlds.com/blog/customer-education/customer-education-strategy/,87.0,no_fit,0,,,Customer education strategy: Scaling success,,,No relevant keywords found — article topic doesn't relate to video translation use cases.,1128
weglot.com,https://www.weglot.com/blog/content-localization,85,medium,,,Elizabeth Pokorny,"Building a content localization strategy — steps, best practices, website focus","Your copy shouldn't be the limit of your content localization. There's a lot more content on your website than the words – think about all the images, videos, and graphics you have on each page.",AI video translator,"Medium fit. The 'Localize Media' section explicitly mentions video localization as important. However, Weglot is a website translation product and this is partly a product blog. They may be open to li",
techsmith.com,https://www.techsmith.com/blog/videos-for-customer-connection/,84,no_fit,,,TechSmith,"How video builds customer connections — personalization, trust, global reach, translation","Camtasia's AI-powered voice translator can make your onboarding videos, product education guides, or other video content global-ready quickly, all without reshooting.",,No fit. The article already promotes TechSmith's own Camtasia voice translator as the video translation solution. They won't link to a competing product.,
transifex.com,https://www.transifex.com/blog/how-to-automate-multilingual-video-at-the-speed-of-localization,84.0,strong,6,"video localization, multilingual video, multiple languages, content localization, multilingual training, subtitle",,How to Automate Multilingual Video,"cebook.com/transifex](https://www.facebook.com/transifex)  [Back](https://www.transifex.com/blog)  [video localization](https://www.transifex.com/blog/tag/video-localization),  [Video Creation Cloud](",translate training videos into multiple languages,"Strong fit — 6 relevant keywords found: video localization, multilingual video, multiple languages, content localization, multilingual training. Content discusses topics where a video translator link ",659
contentful.com,https://www.contentful.com/blog/multilingual-content-marketing/,84,weak,,,Neha Khawas,"Multilingual content marketing at scale — translation vs localization, AI tools, structured content","Photos, videos, branding, pricing can also be localized to engage audiences in different geographies.",,Weak fit. Product blog heavily promoting Contentful's own DXP platform. Mentions video localization briefly but the article is fundamentally a sales piece for their solution. Very unlikely to add exte,
crowdin.com,https://crowdin.com/blog/content-localization,84,weak,,,Yuliia Makarenko,"Content localization best practices — strategy, cultural adaptation, tools, implementation guide","Content localization is the process of adapting content to fit the cultural, linguistic, and regional preferences of specific target markets.",,Weak fit. Product blog for Crowdin's localization platform. Comprehensive guide but heavily promotes Crowdin. Mentions video localization briefly but focused on text/software localization.,
streamyard.com,https://streamyard.com/blog/repurpose-video-content-ai-streamyard,83.0,medium,4,"multiple languages, repurpose video, subtitle, caption",Will Tucker,How to Repurpose Video Content With AI,"ter](https://support.streamyard.com/hc/en-us/articles/44168907570964-AI-clips)) - AI Clips supports multiple languages including English, Spanish, Portuguese, Italian, French, German, Polish, Ukrainia",AI video translator,"Medium fit — 4 relevant keywords found: multiple languages, repurpose video, subtitle, caption.",1040
aioseo.com,https://aioseo.com/the-beginners-guide-to-wordpress-multilingual-seo/,83,no_fit,,,Sherrie Gossett,"WordPress multilingual SEO guide — plugins, hreflang, translation, keyword research",WordPress multilingual SEO can help you captivate and grow an international audience that converts.,,No fit. Technical WordPress SEO tutorial about plugins (AIOSEO + WPML). No discussion of video content or translation tools. Entirely focused on website text/page translation.,
corp.kaltura.com,https://corp.kaltura.com/blog/saas-video-marketing-strategy-for-growth-examples-and-video-types/,83.0,weak,2,"subtitle, caption",,SaaS video marketing strategy for growth,"on Instagram.  Always optimize for mobile first, since most viewers will watch on their phones. Use subtitles so the message is clear even with the sound off, ensuring users can quickly grasp your key",,"Weak fit — only 2 relevant keyword(s): subtitle, caption.",1187
deel.com,https://www.deel.com/blog/companies-best-onboarding-programs/,82,medium,,,Lorelei Trisca,"11 companies with best onboarding programs — Zapier, Buffer, Google, Netflix, Spotify, etc.",new joiners get a taste of what it's like to work for Accenture in an immersive world,AI video translation for multilingual onboarding,Medium fit. Lists best onboarding programs but doesn't discuss multilingual/global onboarding challenges directly. The article mentions global teams and remote onboarding but doesn't address language ,
payproglobal.com,https://payproglobal.com/how-to/expand-saas-business-internationally/,82.0,no_fit,0,,"Marta Poprotska, Social Media Community Manager",How to Expand SaaS Business Internationally,,,No relevant keywords found — article topic doesn't relate to video translation use cases.,902
panopto.com,https://www.panopto.com/blog/microlearning-in-elearning/,82.0,no_fit,0,,,Microlearning in eLearning: Transform Your Training,,,No relevant keywords found — article topic doesn't relate to video translation use cases.,1216
globalization-partners.com,https://www.globalization-partners.com/blog/tips-for-onboarding-international-employees/,82,strong,,,G-P Editorial,"Tips for onboarding international employees globally — local adaptation, compliance, AI tools",Use the local language in onboarding materials if English isn't a requirement for the job.,AI video translation for onboarding materials,Strong fit. The 'Local adaptation' section explicitly says to use local language in onboarding materials. The article discusses making onboarding work across countries but doesn't mention video transl,
oysterhr.com,https://www.oysterhr.com/library/onboarding-best-practices,82,weak,,,Oyster Team,"10 onboarding best practices — preboarding, personalization, goals, automation, feedback",A strong start ensures that they feel connected to the team and ready to do great work from day one.,,"Weak fit. General onboarding best practices article. Mentions global/remote onboarding but doesn't discuss language barriers, video translation, or multilingual content specifically.",
clipchamp.com,https://clipchamp.com/en/blog/video-based-knowledge-remote-teams/,82.0,weak,2,"subtitle, caption",,Share knowledge with remote teams using videos,Make your videos accessible and easily viewable by adding transcripts and captions.   ![step 5c-Add subtitles to videos-5 benefits and easy hacks-Clipchamp Blog](https://media.clipchamp.com/clipchamp/,,"Weak fit — only 2 relevant keyword(s): subtitle, caption.",949
training.safetyculture.com,https://training.safetyculture.com/blog/elearning-translation-services/,81.0,medium,4,"translate training, translate content, translation tool, translate course",,10 Elearning providers with translation services,"se to your employees’ preferred languages, especially for multinational businesses that may need to translate training into more than 10 languages. So when making an [elearning authoring tools compari",translate training videos into multiple languages,"Medium fit — 4 relevant keywords found: translate training, translate content, translation tool, translate course.",991
localizejs.com,https://localizejs.com/articles/the-ultimate-guide-to-video-marketing-strategy,81.0,medium,3,"subtitle, caption, translation tool",,The Ultimate Guide to Video Marketing Strategy,"sing diverse video content, prioritizing authenticity, optimizing video length, adding multilingual subtitles, and leveraging user-generated content for maximum engagement and reach.  ![](https://cdn.",AI video translator,"Medium fit — 3 relevant keywords found: subtitle, caption, translation tool.",773
learndash.com,https://www.learndash.com/blog/how-to-translate-your-online-course-and-why-its-a-good-idea/,81.0,no_fit,0,,,How to Translate Your Online Course,,,No relevant keywords found — article topic doesn't relate to video translation use cases.,1157
cincopa.com,https://www.cincopa.com/blog/how-to-localize-e-learning-videos-for-a-global-audience/,81.0,weak,0,,,Localize E-Learning Videos for Global Audience,,,"Not an article — too short or not editorial content. [Reclassified: was not_article, keeping as weak — may be scrape issue]",6
leadfeeder.com,https://www.leadfeeder.com/blog/marketing-strategy/b2b-video-marketing-strategy/,80.0,no_fit,0,,Jillian Als,B2B Video Marketing: 6 Tips,,,No relevant keywords found — article topic doesn't relate to video translation use cases.,843
screenpal.com,https://screenpal.com/blog/product-demo-videos,80.0,no_fit,0,,,How to create product demo videos,,,No relevant keywords found — article topic doesn't relate to video translation use cases.,917
ukg.com,https://www.ukg.com/blog/hr-leaders/hrs-guide-cultural-competence-global-workforce,80.0,weak,2,"global workforce, global teams",,HR Guide to Cultural Competence in Global Workforce,"-guide-cultural-competence-global-workforce#main-content)  # HR’s Guide to Cultural Competence in a Global Workforce  **Erika Sandoval** Global Senior Partner, HCM Strategic Advisory Group   Oct 2, 20",,"Weak fit — only 2 relevant keyword(s): global workforce, global teams.",1032
aihr.com,https://www.aihr.com/blog/global-hr-management/,79.0,no_fit,0,,Monique Verduyn,9 Successful Global HR Management Strategies,,,No relevant keywords found — article topic doesn't relate to video translation use cases.,944
powtoon.com,https://www.powtoon.com/blog/microsoft-teams-5-ways-video-can-enhance-team-communication/,79.0,weak,1,global workforce,,5 Ways Video Enhances Team Communication in MS Teams,rt and continue a dialogue with their peers and team managers as they would in person.  ## Engage a global workforce  Engaging a global workforce is difficult. It’s something that cannot be fully achi,,Weak fit — only 1 relevant keyword(s): global workforce.,1024
artlist.io,https://artlist.io/blog/elevenlabs-multilingual-v2-live-on-artlist/,79.0,weak,2,"voice cloning, multiple languages",,ElevenLabs Multilingual v2 on Artlist,"dable, Multilingual v2 is less expressive than character-driven voices. It does not support custom [voice cloning](https://artlist.io/ai/voice-generator/voice-cloning), [audio tags](https://artlist.io",,"Weak fit — only 2 relevant keyword(s): voice cloning, multiple languages.",793
playplay.com,https://playplay.com/blog/repurpose-video-content/,79.0,weak,2,"repurpose video, caption",,7 Ways to Repurpose Your Video Content in 2026,OUT](https://playplay.com/design)  ![Close banner](https://playplay.com/icons/close.svg)  # How to Repurpose Video Content: Tips and Strategies for 2026  Marketing  11-05-2025  (Updated 12-02-2025)  !,,"Weak fit — only 2 relevant keyword(s): repurpose video, caption.",1083
360learning.com,https://360learning.com/blog/360learning-ai-translations/,78.0,medium,4,"multiple languages, translate training, multilingual training, multilingual content",,Scale Global Training with One-Click Translations,"ng them tweak the version as needed.""**  But we also know that making training content available in multiple languages comes in, well, multiple forms. **This is why our learning platform can address a",translate training videos into multiple languages,"Medium fit — 4 relevant keywords found: multiple languages, translate training, multilingual training, multilingual content.",920
skilljar.com,https://www.skilljar.com/blog/how-to-create-a-content-localization-strategy-for-a-global-learner-audience-best-practices,78.0,medium,3,"localize content, content localization, global audience",,Content Localization Strategy for Global Learner Audience,"o asking fundamental questions, seek to understand the data behind why executives are asking you to localize content.  For example, you can ask for past and future sales performance in regions or terr",AI video translator for global audiences,"Medium fit — 3 relevant keywords found: localize content, content localization, global audience.",856
prosci.com,https://www.prosci.com/blog/implementing-change-management-on-a-global,78.0,no_fit,0,,,Implement Change Management on Global Scale,,,No relevant keywords found — article topic doesn't relate to video translation use cases.,685
navattic.com,https://www.navattic.com/blog/how-to-scale-global-sales-enablement,78.0,no_fit,0,,,How Intermedia Scaled Global Sales Enablement,,,No relevant keywords found — article topic doesn't relate to video translation use cases.,675
3playmedia.com,https://www.3playmedia.com/blog/subtitling-vs-dubbing/,78.0,strong,5,"video translation, dub, dubbing, subtitle, caption",,Subtitling vs. Dubbing: Which is Right?,"ately, you’ll be better equipped with the knowledge to make the most informed decision about which [video translation](https://www.3playmedia.com/learn/popular-topics/guide-video-translation/) method ",AI video translator,"Strong fit — 5 relevant keywords found: video translation, dub, dubbing, subtitle, caption. Content discusses topics where a video translator link adds value.",1008
dacast.com,https://www.dacast.com/blog/video-training-platform/,78.0,weak,2,"global workforce, multilingual learning",,Ultimate Guide to Video Training Platform,y information—no missed steps or miscommunication—regardless of department or location. - **Train a global workforce with ease:** A scalable video training platform supports multilingual learning prog,,"Weak fit — only 2 relevant keyword(s): global workforce, multilingual learning.",1027
superside.com,https://www.superside.com/blog/content-localization,78.0,weak,2,"localize content, content localization",Miles DePaul,Mastering Global Markets With Content Localization,"hrough cash or hours finding an efficient and reliable solution either. So, let’s talk about how to localize content and creative on a global scale.  ## What is Content Localization and Why Does it Ma",,"Weak fit — only 2 relevant keyword(s): localize content, content localization.",966
poeditor.com,https://poeditor.com/blog/global-localization-examples/,77.0,medium,3,"dub, dubbing, subtitle",,10 Global localization examples,ame-poster.jpeg)  What Netflix localizes:  - Original content production by region. - Subtitles and dubbing. - Artwork and thumbnails. - Trailers and promotional materials. - Recommendation algorithms,AI video dubbing and translation,"Medium fit — 3 relevant keywords found: dub, dubbing, subtitle.",1102
clearcompany.com,https://clearcompany.com/resources/blog/remote-employee-engagement-strategies,77.0,no_fit,0,,,Remote Employee Engagement Strategies,,,No relevant keywords found — article topic doesn't relate to video translation use cases.,939
speechify.com,https://speechify.com/blog/podcast-dubbing/,77.0,strong,5,"dub, dubbing, ai dubbing, multiple languages, global audience",,Podcast Dubbing: Bridging Languages,1. [Home](https://speechify.com/) 2. [Dubbing](https://speechify.com/blog/category/ai-dubbing/) 3. Podcast Dubbing: Bridging Languages and Cultures for a Global Audience  Published onOctober,AI video translator for global audiences,"Strong fit — 5 relevant keywords found: dub, dubbing, ai dubbing, multiple languages, global audience. Content discusses topics where a video translator link adds value.",694
rws.com,https://www.rws.com/blog/what-is-video-localization/,77.0,strong,8,"video localization, localize video, dub, dubbing, multiple languages, subtitle, caption, translation tool",,What Is Video Localization? A Strategic Guide,Skip to main content  # What is video localization: Your toolkit for global video success  ![Abby Schachter](https://www.rws.com/media/dynamic/images/Capture_tcm228-209482.webp?original=.JPG&v=2026040,AI video localization tool,"Strong fit — 8 relevant keywords found: video localization, localize video, dub, dubbing, multiple languages. Content discusses topics where a video translator link adds value.",1184
happyscribe.com,https://www.happyscribe.com/blog/localizing-elearning-courses-guide,77.0,weak,2,"subtitle, caption",,Localizing Your E-Learning Courses: A Full Guide,"Smarter notes with HappyScribe  AI Notetaker, transcription and subtitles powered by AI & humans for top accuracy.  [Get started for free →](https://www.happyscribe.com/users/sign_up)  In today's glob",,"Weak fit — only 2 relevant keyword(s): subtitle, caption.",1072
ewebinar.com,https://ewebinar.com/blog/7-creative-ways-to-repurpose-your-webinar-content,77.0,weak,2,"multiple languages, global audience",,7 Creative Ways to Repurpose Your Webinar Content,"hey search for information to solve their pains.  Additionally, if your webinar includes content in multiple languages, you can enhance its accessibility by providing transcripts. Not only will this c",,"Weak fit — only 2 relevant keyword(s): multiple languages, global audience.",1061
phrase.com,https://phrase.com/blog/posts/language-industry-trends-2026/,76.0,medium,4,"dub, dubbing, ai dubbing, caption",,Key Trends Shaping the Language Industry in 2026,e communities of Deaf or Hard of Hearing or the visually impaired. Innovative applications of AI in dubbing or captioning make the world more equitable and a place where no one is left behind. Look ou,AI video dubbing and translation,"Medium fit — 4 relevant keywords found: dub, dubbing, ai dubbing, caption.",981
chartmogul.com,https://chartmogul.com/blog/prepare-saas-global-expansion/,76.0,no_fit,0,,,How to prepare your SaaS for global expansion,,,No relevant keywords found — article topic doesn't relate to video translation use cases.,932
voice123.com,https://voice123.com/blog/the-voice-over-industry/dubbing/,75.0,excluded_already_mentioned,5,"dub, dubbing, ai dubbing, lip-sync, subtitle",,Dubbing: How to create the best multilingual masterpiece,"[Skip to content](https://voice123.com/blog/the-voice-over-industry/dubbing/#content ""Skip to content"")  ![dubbing](https://voice123.com/blog/wp-content/uploads/2024/04/d1-scaled.jpeg)  - The voice ov",Synthesia video translator,SYNTHESIA MENTIONED: Page already mentions Synthesia but may not link to the video translator page specifically. Pitch adding a direct link to the translator feature. Synthesia is already mentioned in,906
