domain,url,dr,fit_strength,fit_keyword_count,fit_keywords,author_name,article_topic,section_quote,suggested_anchor_text,rationale,word_count
trtc.io,https://trtc.io/blog/details/how-to-translate-subtitles,69.0,medium,3,"multilingual video, subtitle, translation tool",,How to Translate Subtitles: Complete Guide 2026,"ours of video are uploaded to YouTube alone. With audiences spanning 100+ countries, the demand for multilingual video content has never been higher. Whether you're a video creator expanding to new ma",multilingual video translation,"Medium fit — 3 relevant keywords found: multilingual video, subtitle, translation tool.",1104
banzai.io,https://www.banzai.io/blog/video-marketing-strategy-guide,69.0,no_fit,0,,,Level Up Your Video Marketing Strategy: Ultimate Guide,,,No relevant keywords found — article topic doesn't relate to video translation use cases.,1025
epiphan.com,https://www.epiphan.com/blog/sales-enablement-strategy/,69.0,no_fit,0,,,5 ways video can support sales enablement,,,No relevant keywords found — article topic doesn't relate to video translation use cases.,1018
speechmatics.com,https://www.speechmatics.com/company/articles-and-news/best-tts-apis-in-2025-top-12-text-to-speech-services-for-developers,69.0,weak,1,voice cloning,,Best TTS APIs in 2026,"ps://www.neuphonic.com/) | English +, expanding | On-device deployment; open-source option; instant voice cloning | Cloud + on-device options | Privacy-first applications; edge computing | | [**Hume**",,Weak fit — only 1 relevant keyword(s): voice cloning.,970
castmagic.io,https://www.castmagic.io/post/repurposing-video-content,69.0,weak,1,repurpose video,,10 Expert Tips for Repurposing Video Content,st/repurposing-video-content#optimize-your-video-content-for-youtube-shorts-and-vertical-formats)  [Repurpose Video Content Across Multiple Content Formats](https://www.castmagic.io/post/repurposing-v,,Weak fit — only 1 relevant keyword(s): repurpose video.,835
languagewire.com,https://www.languagewire.com/blog/how-to-make-a-good-explainer-video/,68.0,medium,3,"dub, dubbing, ai dubbing",language need,How to make a good explainer video,ervices/in-country-review/) - [Subtitling](https://www.languagewire.com/services/subtitling/) - [AI Dubbing](https://www.languagewire.com/services/ai-dubbing/) - [DTP and Layout](https://www.languagew,AI video dubbing and translation,"Medium fit — 3 relevant keywords found: dub, dubbing, ai dubbing.",719
amberscript.com,https://www.amberscript.com/en/blog/dubbing-vs-subtitles-are-they-both-necessary-for-translation/,68.0,medium,4,"dub, dubbing, subtitle, caption",industry,Dubbing vs Subtitles: Are They Both Necessary?,[Skip to content](https://www.amberscript.com/en/blog/dubbing-vs-subtitles-are-they-both-necessary-for-translation/#skip-to-content)  Products  [Transcription](https://www.amberscript.com/en/transcrip,AI video dubbing and translation,"Medium fit — 4 relevant keywords found: dub, dubbing, subtitle, caption.",553
usemultiplier.com,https://www.usemultiplier.com/global-hr/guide-to-global-employer-branding,68.0,no_fit,0,,,Guide to Global Employer Branding,,,No relevant keywords found — article topic doesn't relate to video translation use cases.,1109
interprefy.com,https://www.interprefy.com/resources/blog/the-language-technology-landscape-an-enterprise-buyers-guide,68.0,weak,2,"subtitle, caption",,Language Technology Landscape 2026,h-translator) - [Live Captions](https://www.interprefy.com/solutions/multilingual-live-captions-and-subtitles)  [**Who We Serve**](https://www.interprefy.com/who-we-serve)  - [Event Organisers](https:,,"Weak fit — only 2 relevant keyword(s): subtitle, caption.",520
academyocean.com,https://academyocean.com/features/multilingual-lms,67.0,medium,3,"multiple languages, multilingual training, global teams",,Multilingual LMS for Diverse E-Learning,administration/icon_1.webp)  ### Breaking Language Barriers  Seamlessly provide training content in multiple languages with [LMS for franchisors](https://academyocean.com/solution/franchise)  ![icon](,translate training videos into multiple languages,"Medium fit — 3 relevant keywords found: multiple languages, multilingual training, global teams.",619
welocalize.com,https://www.welocalize.com/insights/is-your-marketing-localization-strategy-ready-for-whats-next-trends-for-global-teams/,67.0,strong,6,"dub, dubbing, subtitle, caption, multilingual content, global teams",,Marketing Localization Strategy Trends,"now a core expectation. Brands are expanding their use of subtitles, captions, and market-specific dubbing to meet audience preferences.  ## The Role of AI  AI is redefining how global marketing teams",AI video dubbing and translation,"Strong fit — 6 relevant keywords found: dub, dubbing, subtitle, caption, multilingual content. Content discusses topics where a video translator link adds value.",866
woodwing.com,https://www.woodwing.com/blog/building-a-knowledge-sharing-culture-to-boost-remote-team-engagement,66.0,no_fit,0,,,Knowledge sharing culture to boost remote engagement,,,No relevant keywords found — article topic doesn't relate to video translation use cases.,475
vidjet.com,https://www.vidjet.com/blog/understanding-the-importance-of-video-localisation-to-boost-e-learning,66.0,strong,5,"video localization, global audience, subtitle, caption, localization tool",,Video Localisation to Boost E-Learning,d78f1e1_6.png)  ## Summary  This guide provides you with a comprehensive overview of the e-learning video localization process. It outlines the significance of e-learning video localization and the ke,AI video localization tool,"Strong fit — 5 relevant keywords found: video localization, global audience, subtitle, caption, localization tool. Content discusses topics where a video translator link adds value.",866
commlabindia.com,https://www.commlabindia.com/blog/ai-craft-multilingual-training-videos,65.0,excluded_already_mentioned,7,"lip-sync, multilingual video, multiple languages, multilingual training, global workforce, caption, multilingual content",: Akarsh Jain,AI: How it Helps to Craft Multilingual Training Videos,"ces, boost engagement, and build a thriving global workforce. Learn how to leverage text-to-speech, lip-sync animation, and interactive elements to create impactful training experiences that transcend",Synthesia video translator,SYNTHESIA MENTIONED: Page already mentions Synthesia but may not link to the video translator page specifically. Pitch adding a direct link to the translator feature. Synthesia is already mentioned in,959
talkingpts.org,https://talkingpts.org/blog/engage-all-families-with-translated-video-captions/6036/,65.0,medium,3,"video translation, non-english, caption",Paige DeLozier,Engage families with translated video captions,on technology nonprofit  [TalkingPoints](http://35.90.209.29/) announced that it has launched a new video translation feature designed to facilitate more effective communication between teachers and f,AI video translator,"Medium fit — 3 relevant keywords found: video translation, non-english, caption.",826
ulatus.com,https://www.ulatus.com/translation-blog/why-are-video-translation-services-essential-for-the-healthcare-industry/,65.0,weak,2,"video translation, multiple languages",,Why Video Translation is Vital for Healthcare,tm)     - [website localization](https://www.ulatus.com/website-localization/home.htm)     - [Audio/Video translation & localization](https://www.ulatus.com/audio-video-translation-localization.htm)  ,,"Weak fit — only 2 relevant keyword(s): video translation, multiple languages.",626
lilt.com,https://lilt.com/blog/best-ai-translation-tools-choosing-the-right-platform-for-global-communication,65.0,weak,1,translation tool,,Best AI Translation Tools: Choosing the Right Platform,"Localization  January 21, 2026  \|  4 min read  # Best AI Translation Tools: Choosing the Right Platform for Global Communication  We've shifted into an era where leveraging AI for translation is esse",,Weak fit — only 1 relevant keyword(s): translation tool.,1084
saastock.com,https://www.saastock.com/blog/how-to-prepare-for-global-expansion/,65.0,weak,2,"dub, global audience",,How to prepare your SaaS for global expansion,il 2001 it announced its expansion into the worldwide marketplace with new regional headquarters in Dublin and Tokyo. 2. **Acquisition: acquire a business in the region to become your ‘feet on the gro,,"Weak fit — only 2 relevant keyword(s): dub, global audience.",1099
goodhabitz.com,https://www.goodhabitz.com/resources/blog/multilingual-learning-for-global-workforces,65.0,weak,2,"global workforce, multilingual learning",,Why multilingual learning is essential,"s)  [Blog](https://www.goodhabitz.com/resources/blog)  Why multilingual learning is essential for a global workforce  Blog  7 min  Feb 10, 2026  # Why multilingual learning is essential for a global w",,"Weak fit — only 2 relevant keyword(s): global workforce, multilingual learning.",905
teamsoftware.com,https://teamsoftware.com/blog/engaging-distributed-teams-through-technology,63.0,no_fit,0,,,Engaging Distributed Teams Through Technology,,,No relevant keywords found — article topic doesn't relate to video translation use cases.,840
almcorp.com,https://almcorp.com/blog/video-seo-ranking-youtube-google-search-rank-your-videos-at-the-top/,63.0,weak,1,caption,,Video SEO: Ranking Videos on YouTube and Google,"6. **Video Quality Indicators** – Resolution, length, production value, and accessibility features (captions, transcripts) all matter.   ## Comprehensive Keyword Research for Video SEO  Successful vid",,Weak fit — only 1 relevant keyword(s): caption.,1130
7taps.com,https://www.7taps.com/case-study/delivering-job-aids-with-7taps-around-24-countries,63.0,weak,2,"multiple languages, caption",,Creating inclusive job aids with microlearning,"# Leverage AI but support it with a human touch  In 7taps, AI avatars can be programmed to speak in multiple languages. Be sure to have a native speaker review the content for accuracy and adjust as n",,"Weak fit — only 2 relevant keyword(s): multiple languages, caption.",1116
mediashower.com,https://www.mediashower.com/blog/free-ai-video-tools/,62.0,excluded_already_mentioned,0,,,The Best Free AI Video Tools for Marketers,,Synthesia video translator,SYNTHESIA MENTIONED: Page already mentions Synthesia but may not link to the video translator page specifically. Pitch adding a direct link to the translator feature. Synthesia is already mentioned in,910
alconost.com,https://alconost.com/en/blog/tiktok,62.0,no_fit,0,,Margarita Shvetsova,Behind-the-Scenes Look at TikTok Localization Strategy,,,No relevant keywords found — article topic doesn't relate to video translation use cases.,1008
perso.ai,https://perso.ai/de/blog/fastest-way-to-make-multilingual-videos,62.0,strong,13,"video localization, dub, dubbing, voice cloning, lip-sync, multilingual video, multiple languages, localize content",,Fastest Way to Make Multilingual Videos,ed-and-quality-matter-in-multilingual-video-creation) [What Makes Perso AI a Strong Choice for Fast Video Localization](https://perso.ai/de/blog/fastest-way-to-make-multilingual-videos#what-makes-pers,translate training videos into multiple languages,"Strong fit — 13 relevant keywords found: video localization, dub, dubbing, voice cloning, lip-sync. Content discusses topics where a video translator link adds value.",515
voquent.com,https://www.voquent.com/blog/how-to-grow-your-channel-with-the-youtube-multi-audio-track-feature/,62.0,strong,6,"dub, dubbing, global audience, international audience, subtitle, caption",,How to Grow your Channel with YouTube Multi Audio,actors/female/)   - [Non-Binary](https://www.voquent.com/voice-actors/non-binary/) - [Translation & Dubbing](https://www.voquent.com/dubbing/)   - [Translation Services](https://www.voquent.com/transl,AI video translator for global audiences,"Strong fit — 6 relevant keywords found: dub, dubbing, global audience, international audience, subtitle. Content discusses topics where a video translator link adds value.",815
devopsschool.com,https://www.devopsschool.com/blog/top-10-ai-multilingual-voiceover-tools-in-2025-features-pros-cons-comparison/,61.0,medium,4,"dub, dubbing, voice cloning, multiple languages",,Top 10 AI Multilingual Voiceover Tools 2026,"audio processing to deliver lifelike voices, capturing nuances like tone, pitch, and emotion. From dubbing videos and narrating e-learning modules to enhancing customer support with localized voice ag",AI video dubbing and translation,"Medium fit — 4 relevant keywords found: dub, dubbing, voice cloning, multiple languages.",1104
thewordpoint.com,https://thewordpoint.com/blog/e-learning-localization-and-e-learning-translation-requirements-guide,61.0,medium,3,"content localization, global audience, subtitle",,E-Learning Localization and Translation Guide,nderstanding the core e-learning translation requirements and discuss the importance of [e-learning content localization](https://thewordpoint.com/services/translation-service/elearning-content-transl,AI video translator for global audiences,"Medium fit — 3 relevant keywords found: content localization, global audience, subtitle.",1179
celum.com,https://www.celum.com/en/blog/sales-enablement-strategy/,61.0,no_fit,0,,Fabian Greiler,How to create a winning Sales Enablement Strategy,,,No relevant keywords found — article topic doesn't relate to video translation use cases.,901
camb.ai,https://www.camb.ai/es/blog-post/the-ultimate-guide-to-video-translation-tools-and-tips,61.0,strong,9,"video translation, dub, dubbing, multiple languages, global audience, subtitle, caption, translation tool",,Ultimate Guide to Video Translation Tools,# 4 Best Video Translation Tools & Tips (2026 Update)  Discover the best video translation services and software for seamless localization. Essential tips to boost engagement.,AI video translator,"Strong fit — 9 relevant keywords found: video translation, dub, dubbing, multiple languages, global audience. Content discusses topics where a video translator link adds value.",1070
myshyft.com,https://www.myshyft.com/blog/multilingual-shift-communication/,61.0,weak,1,multiple languages,,Multilingual Shift Change Communication,"nges are inevitable in any workplace, but they present unique challenges when your workforce speaks multiple languages. Poor communication across language barriers can lead to missed shifts, unnecessa",,Weak fit — only 1 relevant keyword(s): multiple languages.,645
lingohub.com,https://lingohub.com/blog/how-to-localize-an-e-learning-product-challenges-and-best-practices,60.0,no_fit,0,,,How to localize an e-learning product,,,No relevant keywords found — article topic doesn't relate to video translation use cases.,854
blog.vmgstudios.com,https://blog.vmgstudios.com/localization-versus-translation-video-marketing,60.0,no_fit,0,,,Localization vs. Translation,,,No relevant keywords found — article topic doesn't relate to video translation use cases.,1102
fish.audio,https://fish.audio/blog/ai-audio-translation/,60.0,strong,10,"dub, dubbing, voice cloning, multiple languages, translate content, localize content, content localization, global audience",,AI Audio Translation: Complete Guide 2026,"edia & Entertainment  - Films, documentaries, and podcasts can be localized faster than traditional dubbing.   ##### Features to Look for in AI Voice Translation Tools  If you're choosing an AI voice ",AI video translator for global audiences,"Strong fit — 10 relevant keywords found: dub, dubbing, voice cloning, multiple languages, translate content. Content discusses topics where a video translator link adds value.",1010
onesky.ai,https://onesky.ai/blog/localization-marketing,60.0,weak,1,multilingual content,,Localization Marketing 101: Build a Global Brand,"ky.ai/blog/automated-translation-updates)  Discover how automated translation updates can make your multilingual content faster, more accurate, and culturally relevant.  ![](https://cdn.prod.website-f",,Not an article — too short or not editorial content. [Reclassified: was not_article but has some keyword signals],115
netchex.com,https://netchex.com/the-language-of-learning-the-importance-of-multilingual-training/,59.0,no_fit,0,,,Importance of Multilingual Training,,,No relevant keywords found — article topic doesn't relate to video translation use cases.,1205
adilo.com,https://adilo.com/blog/video-marketing-strategy-for-2026-according-to-experts/,59.0,no_fit,0,,,Ultimate Video Marketing Strategy for 2026,,,No relevant keywords found — article topic doesn't relate to video translation use cases.,730
dubverse.ai,https://dubverse.ai/blog/how-to-get-more-views-on-youtube/,59.0,no_fit,0,,,How to Get More Views on YouTube,,,No relevant keywords found — article topic doesn't relate to video translation use cases.,1173
powell-software.com,https://powell-software.com/resources/blog/employee-engagement-strategies/,59.0,no_fit,0,,,10 Employee Engagement Strategies for Remote Teams,,,No relevant keywords found — article topic doesn't relate to video translation use cases.,929
translate.one,https://www.translate.one/how-to-increase-your-global-audience-reach-with-video-translation/,59.0,strong,5,"video translation, global audience, international audience, subtitle, caption",Translate.One,Increase Global Reach With Video Translation,"dience-reach-with-video-translation/#brx-footer)  # How to Increase Your Global Audience Reach With Video Translation  Video is a powerful marketing tool that engages, educates, and entertains audienc",AI video translator,"Strong fit — 5 relevant keywords found: video translation, global audience, international audience, subtitle, caption. Content discusses topics where a video translator link adds value.",885
acclaro.com,https://www.acclaro.com/blog/maximizing-impact-with-localized-video-your-complete-guide/,59.0,strong,8,"video translation, video localization, localize video, dub, dubbing, multiple languages, global audience, subtitle",,Maximizing Impact with Localized Video,"ket.  ## Understanding localized video  So, what is video localization, and how does it differ from video translation? Simply put, it’s the process of [adapting content to account for cultural norms](",AI video translator,"Strong fit — 8 relevant keywords found: video translation, video localization, localize video, dub, dubbing. Content discusses topics where a video translator link adds value.",1064
vozo.ai,https://www.vozo.ai/blogs/dub-vs-subtitles,59.0,strong,7,"video localization, dub, dubbing, lip sync, lip-sync, subtitle, caption",,Dub vs Subtitles: Which is Better for Video Localization,ontent/uploads/2025/06/11104238/dubbing-vs-subtitles.webp)  # Dub vs Subtitles: Which is Better for Video Localization  ![Picture of Sarah Miller](https://www.vozo.ai/wp-content/uploads/2026/03/croppe,AI video localization tool,"Strong fit — 7 relevant keywords found: video localization, dub, dubbing, lip sync, lip-sync. Content discusses topics where a video translator link adds value.",1084
sync.so,https://sync.so/blog/how-to-use-ai-lip-sync-tools-for-professional-video-editing-step-by-step-guide-2/,58.0,medium,4,"dub, dubbing, lip sync, lip-sync",,How to use ai lip-sync tools for video editing,like interviews and e-learning. - [fal](https://fal.ai/?ref=sync.so): Specializes in multi-language dubbing with customizable tones.  **Step 2: Upload Your Video and Audio Files**  Start by importing ,AI video dubbing and translation,"Medium fit — 4 relevant keywords found: dub, dubbing, lip sync, lip-sync.",1010
bluetext.com,https://bluetext.com/blog/creating-scalable-content-marketing-frameworks-for-global-saas-companies/,58.0,weak,1,global audience,,Scalable Content Marketing Frameworks for Global SaaS,"to ensuring your [messaging](https://bluetext.com/our-work/messaging-positioning/) resonates with a global audience while maintaining consistency and efficiency.  In this post, we’ll explore how to cr",,Weak fit — only 1 relevant keyword(s): global audience.,1041
distribution.ai,https://www.distribution.ai/blog/content-localization-shorts-reels-tiktok,58.0,weak,1,content localization,,"Content Localization for Shorts, Reels & TikTok","/ ""Home"") - \> - [Content Marketing](https://www.distribution.ai/category/content-marketing) - \> - Content Localization for Shorts, Reels & TikTok: 2026 GuideContent Localization for Shorts,...  Cont",,Weak fit — only 1 relevant keyword(s): content localization.,652
motionpoint.com,https://www.motionpoint.com/blog/unlocking-new-markets-with-localized-video-content-in-2025/,57.0,strong,6,"multilingual video, multiple languages, global audience, subtitle, localization tool, multilingual content",,Unlocking New Markets with Localized Video Content,eliver localized video content that speaks directly to diverse cultures and languages. A successful multilingual video strategy not only fosters deeper customer connections but also strengthens global,multilingual video translation,"Strong fit — 6 relevant keywords found: multilingual video, multiple languages, global audience, subtitle, localization tool. Content discusses topics where a video translator link adds value.",729
argosmultilingual.com,https://www.argosmultilingual.com/blog/global-compliance-local-consistency-ensuring-effective-localized-training-worldwide,57.0,weak,1,global audience,,"Global Compliance, Local Consistency","ebook). This resource offers practical steps to help you customize your eLearning initiatives for a global audience.  ### Keeping Training Materials Up to Date  As part of the process, it’s important ",,Weak fit — only 1 relevant keyword(s): global audience.,892
gmrtranscription.com,https://www.gmrtranscription.com/blog/podcast-translation-are-podcasts-getting-more-multilingual,56.0,medium,3,"multiple languages, global audience, subtitle",,Podcast Translation: More Multilingual?,ts of Creating Multilingual Podcasts**  Transcribing and translating English-language podcasts into multiple languages is generally worth the effort and investment.  Translating a podcast episode is g,AI video translator for global audiences,"Medium fit — 3 relevant keywords found: multiple languages, global audience, subtitle.",914
qandle.com,https://www.qandle.com/blog/ai-for-global-hr/,56.0,medium,4,"global workforce, caption, global teams, multilingual learning",,AI Global HR: Managing Multilingual Remote Teams,agement systems](https://www.qandle.com/performance-management-software.html) creates comprehensive global workforce visibility.  ## **How Can AI Help Manage Multilingual Teams Effectively?**  ### **R,AI video translator,"Medium fit — 4 relevant keywords found: global workforce, caption, global teams, multilingual learning.",878
clueso.io,https://www.clueso.io/blog/ai-video-translation,56.0,strong,9,"translate video, video translation, video localization, localize video, multiple languages, global audience, subtitle, caption",,AI Video Translation for Customer Education,"lly translating each video or shelling out big bucks on expensive translation agencies, you can now translate videos in minutes, not weeks, with AI.  ‍Translation contextualises your [explainer videos",AI video translator,"Strong fit — 9 relevant keywords found: translate video, video translation, video localization, localize video, multiple languages. Content discusses topics where a video translator link adds value.",1055
localizationinstitute.com,https://www.localizationinstitute.com/a-media-localization-primer-types-challenges-and-future-avenues/,56.0,strong,6,"dub, dubbing, lip sync, lip-sync, subtitle, caption",,A Media Localization Primer,"opportunities.  There are three main types of media localization: (1) subtitling & captioning, (2) dubbing, and (3) voice-over. The type of media localization used depends on the preferences of the ta",AI video dubbing and translation,"Strong fit — 6 relevant keywords found: dub, dubbing, lip sync, lip-sync, subtitle. Content discusses topics where a video translator link adds value.",942
guildhawk.com,https://www.guildhawk.com/blog/what-is-ai-dubbing-your-comprehensive-guide-from-guildhawk,54.0,strong,6,"dub, dubbing, ai dubbing, voice cloning, lip sync, multilingual video",,What is AI Dubbing? Comprehensive guide,guildhawk.com/)  ![open-menu](https://www.guildhawk.com/hubfs/Hamburger%20Menu%20Icon@2x.svg)  ![AI dubbing](https://www.guildhawk.com/hs-fs/hubfs/AI-Generated%20Media/Images/AI%20dubbing.png?length=1,multilingual video translation,"Strong fit — 6 relevant keywords found: dub, dubbing, ai dubbing, voice cloning, lip sync. Content discusses topics where a video translator link adds value.",882
coggno.com,https://coggno.com/blog/how-to-scale-compliance-training-globally-choosing-a-company-with-multilingual-support/,54.0,weak,1,global workforce,,How to Scale Compliance Training Globally,"ook for in a compliance training provider to ensure your program can be scaled effectively across a global workforce.  ### **1\. True Localization, Not Just Translation**  What It Is: Localization is ",,Weak fit — only 1 relevant keyword(s): global workforce.,697
rallyrecruitmentmarketing.com,https://rallyrecruitmentmarketing.com/2025/09/best-employer-brand-video-examples-2025-featuring-atb-westpac-and-cbre/,53.0,no_fit,0,,Lori Sylvia,Best Employer Brand Video Examples 2025,,,No relevant keywords found — article topic doesn't relate to video translation use cases.,981
humanfocus.co.uk,https://humanfocus.co.uk/blog/multilingual-health-and-safety-platform-experience/,53.0,no_fit,0,,,Multilingual Health and Safety Platform,,,No relevant keywords found — article topic doesn't relate to video translation use cases.,1215
