domain,url,dr,fit_strength,fit_keyword_count,fit_keywords,author_name,article_topic,section_quote,suggested_anchor_text,rationale,word_count
senseilms.com,https://senseilms.com/translate-elearning/,75.0,medium,3,"multiple languages, international audience, translation tool",,eLearning Localization: How to Translate Online Course,ent=translate-elearning) is a perfect tool for building online courses that are easy to localize in multiple languages. It’s a [WordPress](https://wordpress.org/) LMS plugin that can be used by entrep,AI video translator for global audiences,"Medium fit — 3 relevant keywords found: multiple languages, international audience, translation tool.",1069
universumglobal.com,https://universumglobal.com/resources/blog/employer-branding-videos:-how-to-create-them-and-best-examples/,75.0,no_fit,0,,"Universum, 2024-11-06",Creating Inspiring Employer Branding Videos,,,No relevant keywords found — article topic doesn't relate to video translation use cases.,1070
ignitevisibility.com,https://ignitevisibility.com/video-marketing-guide/,75.0,no_fit,0,,,Developing a Video Marketing Strategy,,,No relevant keywords found — article topic doesn't relate to video translation use cases.,972
guidde.com,https://www.guidde.com/knowledge-hub/onboarding-video-best-practices-guide-2026,75.0,no_fit,0,,,Onboarding Video Best Practices: Complete Guide 2026,,,No relevant keywords found — article topic doesn't relate to video translation use cases.,971
smartling.com,https://www.smartling.com/blog/ai-for-video-localization,75.0,strong,14,"translate video, video translation, video localization, dub, dubbing, ai dubbing, voice cloning, lip-sync",,AI for video localization: 6 best practices,components of AI-powered video localization include:  - **Subtitling:** Automatically generate and translate video subtitles and captions to accelerate cross-cultural adaptation and increase accessibi,AI video translator,"Strong fit — 14 relevant keywords found: translate video, video translation, video localization, dub, dubbing. Content discusses topics where a video translator link adds value.",680
akool.com,https://akool.com/blog-posts/ai-training-videos,75.0,strong,5,"multiple languages, translate training, global audience, global workforce, translation tool",,AI Training Videos: Translation Tools Simplify Global,"training videos are transformative for global operations, making it possible to deliver training in multiple languages from a single source video.  This not only eliminates language barriers but also ",translate training videos into multiple languages,"Strong fit — 5 relevant keywords found: multiple languages, translate training, global audience, global workforce, translation tool. Content discusses topics where a video translator link adds value.",784
amnhealthcare.com,https://www.amnhealthcare.com/amn-insights/language-services/whitepapers/beyond-words-boosting-patient-safety-with-video-localization/,75.0,weak,2,"video localization, multilingual video",,Boosting Patient Safety with Video Localization,"ts/language-services/whitepapers/)  January 28, 2026   # Beyond Words: Boosting Patient Safety with Video Localization  Clear communication is the cornerstone of effective healthcare. Yet, millions of",,"Weak fit — only 2 relevant keyword(s): video localization, multilingual video.",1004
lokalise.com,https://lokalise.com/blog/marketing-localization/,75.0,weak,2,"content localization, localization tool",,Marketing Localization: Strategy,"ps://lokalise.com/blog/author/stefanos-bournias/)Updated on April 14, 2025·13 min read  ![Marketing content localization graphic illustration](https://lokalise.com/uploads/marketing_localization_132b5",,"Weak fit — only 2 relevant keyword(s): content localization, localization tool.",685
easygenerator.com,https://www.easygenerator.com/en/blog/e-learning/best-training-video-software/,74.0,excluded_already_mentioned,7,"lip-sync, multilingual video, multiple languages, localize content, multilingual training, multilingual content, global teams",Rares Bratucu,Best training video software in 2026,cognized AI video platforms. It focuses on creating high-quality avatar-based videos with realistic lip-sync and natural delivery.  Teams can turn scripts into videos in minutes without filming. The p,Synthesia video translator,SYNTHESIA MENTIONED: Page already mentions Synthesia but may not link to the video translator page specifically. Pitch adding a direct link to the translator feature. Synthesia is already mentioned in,1103
simpleshow.com,https://simpleshow.com/blog/how-to-create-inclusive-corporate-videos-for-global-audiences/,74.0,medium,4,"global audience, global workforce, subtitle, global teams",,How to create inclusive corporate videos for global audiences,­  How to create inclusive corporate videos for global audiences - simpleshow  Please note: This website includes an accessibility system. Press Control-F11 to adjust the website to people with visual,AI video translator for global audiences,"Medium fit — 4 relevant keywords found: global audience, global workforce, subtitle, global teams.",800
vectorsolutions.com,https://www.vectorsolutions.com/resources/course-catalogs/health-safety-environment-hse-foreign-language-training-library/,74.0,medium,4,"multiple languages, multilingual training, global workforce, non-english",,Multilingual Safety Training HSE Library,hse-foreign-language-training-library/)  ## Translated Safety Courses to Support OSHA Compliance in Multiple Languages  Vector Solutions offers multilingual safety training designed to help diverse te,translate training videos into multiple languages,"Medium fit — 4 relevant keywords found: multiple languages, multilingual training, global workforce, non-english.",610
hrcloud.com,https://www.hrcloud.com/blog/global-employee-onboarding-guide,74.0,no_fit,0,,,Global Employee Onboarding Guide,,,No relevant keywords found — article topic doesn't relate to video translation use cases.,390
thoughtindustries.com,https://www.thoughtindustries.com/blog/customer-education-strategy/,74.0,no_fit,0,,,How to Build an Effective Customer Education Strategy,,,No relevant keywords found — article topic doesn't relate to video translation use cases.,972
axioshq.com,https://www.axioshq.com/insights/remote-employee-engagement-how-to-boost-employee-engagement-in-remote-and-hybrid-settings,74.0,no_fit,0,,,Remote employee engagement: How to boost,,,No relevant keywords found — article topic doesn't relate to video translation use cases.,957
lemonlight.com,https://www.lemonlight.com/blog/scale-global-campaigns-using-ai-video-localization/,74.0,strong,7,"video localization, dub, dubbing, voice cloning, multiple languages, global audience, subtitle",,Scale Global Campaigns Using AI Video Localization,"aigns-using-ai-video-localization/#main)  Attract More Customers  # Scale Global Campaigns Using AI Video Localization  January 12, 202612 min read201  0Shares  - [LinkedIn](https://www.lemonlight.com",AI video localization tool,"Strong fit — 7 relevant keywords found: video localization, dub, dubbing, voice cloning, multiple languages. Content discusses topics where a video translator link adds value.",1037
verbit.ai,https://verbit.ai/general/dubbing-and-localization-what-you-need-to-know/,74.0,strong,9,"dub, dubbing, ai dubbing, localize content, content localization, global audience, international audience, subtitle",,AI dubbing and content localization,[Skip to main content](https://verbit.ai/general/dubbing-and-localization-what-you-need-to-know/#primary-content)  Blog  # AI dubbing and global content localization: What creators and enterprises nee,AI video translator for global audiences,"Strong fit — 9 relevant keywords found: dub, dubbing, ai dubbing, localize content, content localization. Content discusses topics where a video translator link adds value.",1089
lionbridge.com,https://www.lionbridge.com/blog/translation-localization/top-5-tips-for-localizing-video-and-audio-content/,74.0,weak,1,video localization,,Top 5 Tips for Localizing Video and Audio Content,rvices**](https://www.lionbridge.com/content-transformation-services/translation-localization/)  - [Video Localization](https://www.lionbridge.com/content-transformation-services/multimedia-localizati,,Not an article — too short or not editorial content. [Reclassified: was not_article but has some keyword signals],293
daytranslations.com,https://www.daytranslations.com/blog/audio-and-video-translation-capturing-multilingual-audiences-through-media/,74.0,weak,2,"video translation, multiple languages",,Audio and Video Translation,696853) [contact@daytranslations.com](mailto:contact@daytranslations.com)  Search`Esc`  ![Audio and Video Translation: Capturing Multilingual Audiences through Media](https://www.daytranslations.com/b,,"Weak fit — only 2 relevant keyword(s): video translation, multiple languages.",632
pagetiger.com,https://www.pagetiger.com/blog/5-emerging-learning-and-development-trends,74.0,weak,2,"multiple languages, multilingual content",,5 Emerging Learning and Development Trends for 2026,"sations with distributed workforces are also prioritising accessibility - translating learning into multiple languages is essential for inclusion, comprehension and scale. Centralised platforms make i",,"Weak fit — only 2 relevant keyword(s): multiple languages, multilingual content.",1014
darwinbox.com,https://darwinbox.com/blog/how-darwinbox-enables-localization,73.0,medium,3,"multiple languages, global workforce, localization tool",,How Darwinbox Enables Localization,"ees that are spread out around the world to communicate and work well together. By offering help in multiple languages and adapting communication tools to different languages, companies make it easier",AI video translator,"Medium fit — 3 relevant keywords found: multiple languages, global workforce, localization tool.",1043
globallink.transperfect.com,https://globallink.transperfect.com/blog/multilingual-marketing-how-to-reach-foreign-language-audiences,73.0,medium,3,"multiple languages, global audience, multilingual content",,How to Reach a Global Audience with Multilingual Marketing,"tilingual Marketing?**  Multilingual marketing is the practice of promoting products or services in multiple languages. Take Singapore, for example, where English, Malay, Mandarin, and Tamil are widel",AI video translator for global audiences,"Medium fit — 3 relevant keywords found: multiple languages, global audience, multilingual content.",1064
chronus.com,https://chronus.com/blog/engaging-remote-workers,73.0,no_fit,0,,,Ultimate Guide for Remote Employee Engagement,,,No relevant keywords found — article topic doesn't relate to video translation use cases.,1030
trados.com,https://www.trados.com/blog/taking-your-business-into-a-new-market/,73.0,no_fit,0,,,Taking your business into a new market,,,No relevant keywords found — article topic doesn't relate to video translation use cases.,968
transperfect.com,https://www.transperfect.com/blog/10-best-practices-video-localization,73.0,strong,6,"video localization, dub, dubbing, global audience, subtitle, caption",,10 Best Practices for Video Localization,"g, allowing for multilingual users to access a variety of content.  Here are ten best practices for video localization to help your video content reach a global audience:  ### 1.Create content with in",AI video localization tool,"Strong fit — 6 relevant keywords found: video localization, dub, dubbing, global audience, subtitle. Content discusses topics where a video translator link adds value.",554
bloomfire.com,https://bloomfire.com/blog/knowledge-sharing-platform-vs-knowledge-base/,72.0,strong,0,,,Knowledge Sharing Platform Vs Knowledge Base,,AI video translator,COMPETITOR OPPORTUNITY: Page mentions a competitor. Pitch replacing or adding Synthesia alongside. Article mentions competitors and has limited fit for video translator link.,939
resemble.ai,https://www.resemble.ai/best-voice-ai-models-multilingual-speech/,72.0,strong,5,"voice cloning, multiple languages, global audience, translation tool, multilingual content",,Best Multilingual AI Text-To-Speech Tools 2026,"And Consent**  Always review usage rights. Confirm commercial licensing, redistribution terms, and voice cloning consent rules. Clear policies protect both creators and businesses from legal surprises",AI video translator for global audiences,"Strong fit — 5 relevant keywords found: voice cloning, multiple languages, global audience, translation tool, multilingual content. Content discusses topics where a video translator link adds value.",1027
sociabble.com,https://www.sociabble.com/blog/sociabble-features/video-communication-uniting-global-teams/,72.0,strong,5,"video translation, multiple languages, global workforce, subtitle, global teams",,Video Communication: Uniting Global Teams,"the need for messages in multiple languages. This approach also resulted in substantial savings on video translation costs. SEV prioritizes security, compliance, and inclusivity by offering transcript",AI video translator,"Strong fit — 5 relevant keywords found: video translation, multiple languages, global workforce, subtitle, global teams. Content discusses topics where a video translator link adds value.",966
moveworks.com,https://www.moveworks.com/us/en/resources/blog/global-hr-service-delivery,72.0,weak,2,"global workforce, global teams",,How AI Transforms Global HR Service Delivery,global-hr-service-delivery-in-the-modern-enterprise)  [The challenges of delivering HR service to a global workforce](https://www.moveworks.com/us/en/resources/blog/global-hr-service-delivery#the-chal,,"Weak fit — only 2 relevant keyword(s): global workforce, global teams.",902
gotolstoy.com,https://www.gotolstoy.com/blog/ai-video-tools,71.0,excluded_already_mentioned,3,"translate video, multiple languages, subtitle",,Top 8 AI Video Tools for E-Commerce,"d on editing efficiency, translation, and content accessibility. It helps teams generate subtitles, translate videos into multiple languages, and create searchable transcripts that improve usability. ",Synthesia video translator,SYNTHESIA MENTIONED: Page already mentions Synthesia but may not link to the video translator page specifically. Pitch adding a direct link to the translator feature. Synthesia is already mentioned in,873
inworld.ai,https://inworld.ai/resources/best-ai-voice-generators,71.0,excluded_already_mentioned,3,"dub, dubbing, voice cloning",,Best AI Voice Generators 2026,"esia Sonic 3 (90ms TTFA) - **Best for content creators + multilingual:** ElevenLabs (70+ languages, dubbing, voice library) - **Best single-vendor voice agent stack:** Inworld (TTS + Realtime API with",Synthesia video translator,SYNTHESIA MENTIONED: Page already mentions Synthesia but may not link to the video translator page specifically. Pitch adding a direct link to the translator feature. Synthesia is already mentioned in,1022
blog.videoscribe.co,https://blog.videoscribe.co/going-global-with-your-explainer-video-voice-over,71.0,medium,3,"video translation, multiple languages, caption",Naomi Linford,Going global with your explainer video voice-over,", the message may become distorted because the original translator misunderstood something, and the video translation could do more harm than good.  Most translation agencies will offer to proof-read ",AI video translator,"Medium fit — 3 relevant keywords found: video translation, multiple languages, caption.",1047
infosysbpm.com,https://www.infosysbpm.com/blogs/digital-business-services/global-content-strategy-approach-for-brands.html,71.0,medium,3,"multiple languages, global audience, global teams",Infosys BPM,Scaling content with a global content strategy,"re while maintaining a high level of quality. For instance, businesses can scale content efforts in multiple languages and formats with minimal manual effort. By leveraging AI for content creation at ",AI video translator for global audiences,"Medium fit — 3 relevant keywords found: multiple languages, global audience, global teams.",918
enboarder.com,https://enboarder.com/blog/best-onboarding-practices/,71.0,no_fit,0,,,Onboarding Best Practices,,,No relevant keywords found — article topic doesn't relate to video translation use cases.,1131
smartcat.com,https://www.smartcat.com/training-video-creator/,71.0,strong,9,"video translation, dub, dubbing, ai dubbing, multilingual training, international audience, subtitle, localization tool",,Training Video Creator - Powered by AI,"ccess\\ \\ Learn about Smartcat AI Dubbing, a groundbreaking multilingual solution that streamlines video translation into more than 280 languages.](https://www.smartcat.com/cases/expondo/)  ## Start ",AI video translator,"Strong fit — 9 relevant keywords found: video translation, dub, dubbing, ai dubbing, multilingual training. Content discusses topics where a video translator link adds value.",995
getblend.com,https://www.getblend.com/blog/influencers-video-content-localization-strategy/,71.0,strong,7,"video translation, dub, dubbing, lip-sync, content localization, subtitle, caption",,Video Content Localization Strategy with Influencers,"anded well when told in one language, but it might go over the heads of viewers in another country. Video translations often make minor tweaks to colloquialisms to ensure the spirit of the content rem",AI video translator,"Strong fit — 7 relevant keywords found: video translation, dub, dubbing, lip-sync, content localization. Content discusses topics where a video translator link adds value.",587
rask.ai,https://www.rask.ai/blog/how-video-content-localization-can-help-scaling-products-global,71.0,strong,8,"video localization, localize video, dub, dubbing, content localization, global audience, subtitle, localization tool",,How Video Content Localization Can Help Scaling Your Products,h-of-which-is-critical-to-achieving-a-successful-outcome)  [h3\\ \\ Unboxing the Latest AI Tool for Video Localization](https://www.rask.ai/blog/how-video-content-localization-can-help-scaling-product,AI video localization tool,"Strong fit — 8 relevant keywords found: video localization, localize video, dub, dubbing, content localization. Content discusses topics where a video translator link adds value.",976
maestra.ai,https://maestra.ai/blogs/video-localization-10-best-practices,71.0,strong,9,"video localization, dub, dubbing, ai dubbing, voice cloning, multiple languages, content localization, global audience",,What Is Video Localization? 10 Best Practices,# What Is Video Localization? Best Practices and Examples for 2025  - Updated: 2025-05-09 - [Serra Ardem](https://maestra.ai/authors/serra-ardem) - 7m to read  ![What Is Video Lo,AI video localization tool,"Strong fit — 9 relevant keywords found: video localization, dub, dubbing, ai dubbing, voice cloning. Content discusses topics where a video translator link adds value.",1001
captions.ai,https://captions.ai/blog/video-localization-a-complete-guide-for-global-brands,71.0,strong,7,"video localization, dub, dubbing, lip sync, lip-sync, subtitle, caption",,What Is Video Localization? A Guide For Global Brands,"l. Things like tone, references, and even visual context influence how a message lands.  That’s why video localization has become a priority for global brands. Getting this right is a crucial step to ",AI video localization tool,"Strong fit — 7 relevant keywords found: video localization, dub, dubbing, lip sync, lip-sync. Content discusses topics where a video translator link adds value.",1192
typeface.ai,https://www.typeface.ai/blog/how-to-use-ai-to-repurpose-video-content,71.0,strong,1,repurpose video,,How to Use AI to Repurpose Videos,"June 17, 2025  # How to Use AI to Repurpose Videos into Blogs, Emails, and Social Posts  ![Akshita Sharma](https://images.ctfassets.net/x690ow8339ug/1kwk2CPXBcmGHiwwcn38fH/cce938527bf7d822ff94f443f16",AI video translator,COMPETITOR OPPORTUNITY: Page mentions a competitor. Pitch replacing or adding Synthesia alongside. Article mentions competitors and has limited fit for video translator link.,791
theinvestorspodcast.com,https://www.theinvestorspodcast.com/business/global-podcasting-strategies-for-translating-your-audio-content/,71.0,strong,8,"dub, dubbing, global audience, non-english, subtitle, caption, translation tool, multilingual content",,Global Podcasting: Strategies for Translating Audio,"fast, but human translators offer more authenticity and cultural translation.  ### Employ AI Voice Dubbing for Smooth Translations  Rather than offer subtitles or transcripts, AI voice dubbing enables",AI video translator for global audiences,"Strong fit — 8 relevant keywords found: dub, dubbing, global audience, non-english, subtitle. Content discusses topics where a video translator link adds value.",946
tomedes.com,https://www.tomedes.com/tomedes-insider/what-is-tik-tok.php,71.0,weak,1,localize content,Ofer Tirosh_,TikTok: Localization Done Right at Global Scale,"ization service and and coordinating with the right localization experts.  One of the usual ways to localize content is to have it translated. But as you know, TikTok’s content didn’t need any of that",,Weak fit — only 1 relevant keyword(s): localize content.,1105
papirfly.com,https://www.papirfly.com/blog/employer-branding/localized-employer-branding-regional-talent/,71.0,weak,1,global workforce,,Localized employer branding: Regional talent,"specific requirements, rather than pushing ahead with a generic, one-size-fits-all message for your global workforce.  But what more does localized employer branding do for your company? And how do yo",,Weak fit — only 1 relevant keyword(s): global workforce.,923
testimonialhero.com,https://www.testimonialhero.com/blog/8-of-the-best-testimonial-videos-and-what-makes-them-great,71.0,weak,1,caption,,8 Best Testimonial Videos,from Facebook accounts has grown by [3.5%](https://www.socialinsider.io/blog/facebook-video-study/#captionlength) between 2020–2021.  ![](https://cdn.prod.website-files.com/61e9bba1ce5e643f48e0e0b8/61,,Weak fit — only 1 relevant keyword(s): caption.,1004
desygner.com,https://desygner.com/blog/content-localization/,71.0,weak,0,,,Content Localization: 5 Key Areas to Go Global,,,"Not an article — too short or not editorial content. [Reclassified: was not_article, keeping as weak — may be scrape issue]",25
globalapptesting.com,https://www.globalapptesting.com/localization-testing/localization-gtm-strategy,71.0,weak,1,multiple languages,,Localization: Crucial Step in GTM Strategy,our brand voice and terminology.  - **Using an LSP or external party**. This is the best option for multiple languages and specialized content. LSPs draw on a large pool of translators and localizatio,,Weak fit — only 1 relevant keyword(s): multiple languages.,1227
creatify.ai,https://creatify.ai/blog/reaching-global-audiences-with-multilingual-video-content,70.0,medium,4,"multilingual video, multiple languages, global audience, multilingual content",Creatify Team,Reaching Global Audiences with Multilingual Video Content,[Video Marketing](https://creatify.ai/category/video-marketing)  # Reaching global audiences with multilingual video content  ![](https://framerusercontent.com/images/d14H2aVWbb1zacuBj1OlX5qI0.png?wid,multilingual video translation,"Medium fit — 4 relevant keywords found: multilingual video, multiple languages, global audience, multilingual content.",822
idearocketanimation.com,https://idearocketanimation.com/18413-distribute-video-content/,70.0,medium,3,"international audience, repurpose video, caption",,10 Clever Ways To Distribute and Repurpose Video Content,"om/16934-guide-translating-video-content/) into different languages can help broaden your reach for international audiences.  Plus, transcription creates more interactive experiences by allowing you t",AI video translator for global audiences,"Medium fit — 3 relevant keywords found: international audience, repurpose video, caption.",1056
intellum.com,https://www.intellum.com/resources/blog/2026-learning-and-development-trends,70.0,no_fit,0,,,2026 L&D Trends: How AI Is Reshaping Learning,,,No relevant keywords found — article topic doesn't relate to video translation use cases.,783
superpath.co,https://www.superpath.co/blog/global-content-strategy,70.0,no_fit,0,,,Guide to Creating a Global Content Strategy,,,No relevant keywords found — article topic doesn't relate to video translation use cases.,1078
directiveconsulting.com,https://directiveconsulting.com/blog/the-b2b-expansion-marketing-playbook-for-rapid-hyper-localized-market-entry/,70.0,no_fit,0,,,B2B Expansion Marketing Playbook,,,No relevant keywords found — article topic doesn't relate to video translation use cases.,1061
bigvu.tv,https://bigvu.tv/blog/drive-global-e-commerce-sales-master-multilingual/,70.0,strong,5,"multilingual video, multiple languages, subtitle, caption, multilingual content",,Drive Global E-commerce Sales: Master Multilingual Video,"an emotion. To help you dominate the digital marketplace, we will explore:  - Expert strategies for multilingual video marketing to expand your global appeal. - Methods for integrating video into the ",multilingual video translation,"Strong fit — 5 relevant keywords found: multilingual video, multiple languages, subtitle, caption, multilingual content. Content discusses topics where a video translator link adds value.",1068
