domain,url,dr,fit_strength,fit_keyword_count,fit_keywords,author_name,article_topic,section_quote,suggested_anchor_text,rationale,word_count
lipsync.studio,https://lipsync.studio/blog/how-to-lip-sync-video,53.0,strong,8,"dub, dubbing, voice cloning, lip sync, lip-sync, content localization, global audience, subtitle",,Complete Guide to AI-Powered Video Lip Synchronization,eo.png&w=1920&q=75)  ## What is Video Lip Sync?  Video lip sync (also known as lip-syncing or audio dubbing) is the process of synchronizing a person's lip movements in a video with a different audio ,AI video translator for global audiences,"Strong fit — 8 relevant keywords found: dub, dubbing, voice cloning, lip sync, lip-sync. Content discusses topics where a video translator link adds value.",1301
herenow.film,https://www.herenow.film/video-seo-guide,53.0,weak,2,"global audience, caption",__Ed Smit,Video SEO Guide For YouTube & Google,nts are increasingly featured in Google results—use them.     - Multi-language captions can open up global audiences. 12. **Analyse & Iterate**         - Monitor YouTube Analytics and Google Search Co,,"Weak fit — only 2 relevant keyword(s): global audience, caption.",957
youngurbanproject.com,https://www.youngurbanproject.com/best-ai-voiceover-tools/,53.0,weak,2,"voice cloning, lip sync",,Best AI Voiceover Tools 2026,"onestly? Some of the results are better than amateur voice actors.  And like I mentioned earlier, **voice cloning** is becoming a big deal. Tools like ElevenLabs or Descript let you feed in audio samp",,"Weak fit — only 2 relevant keyword(s): voice cloning, lip sync.",1229
proceedinnovative.com,https://www.proceedinnovative.com/blog/video-seo-guide-2025/,52.0,no_fit,0,,Jasmine Panayotov,Video SEO in 2025: 10 Proven Ways to Rank,,,No relevant keywords found — article topic doesn't relate to video translation use cases.,848
redokun.com,https://redokun.com/blog/marketing-localization,52.0,no_fit,0,,,Marketing Localization 101 Guide,,,No relevant keywords found — article topic doesn't relate to video translation use cases.,797
trainn.co,https://trainn.co/blog/how-to-use-videos-in-customer-service/,52.0,strong,0,,,Enhance Customer Service with Videos,,AI video translator,COMPETITOR OPPORTUNITY: Page mentions a competitor. Pitch replacing or adding Synthesia alongside. Article mentions competitors and has limited fit for video translator link.,683
flagright.com,https://www.flagright.com/post/the-definitive-guide-to-mastering-multilingual-compliance-in-global-operations,52.0,weak,1,multiple languages,,A Guide to Mastering Multilingual Compliance,"o data privacy, financial transactions, taxation, and anti-money laundering (AML), among others, in multiple languages.  Mastering multilingual compliance is a significant undertaking, but it's of par",,Weak fit — only 1 relevant keyword(s): multiple languages.,832
5mins.ai,https://www.5mins.ai/resources/blog/the-multi-format-magic-of-microlearning-platforms-video-text-and-interactive-training-success,52.0,weak,1,subtitle,,Multi-Format Magic of Microlearning Platforms,t Practices for Video Microlearning:**  - Keep videos under 5 minutes for maximum engagement. - Use subtitles to enhance accessibility. - Include a clear call-to-action or follow-up activity.  * * *  ,,Weak fit — only 1 relevant keyword(s): subtitle.,824
beverlyboy.com,https://beverlyboy.com/filmmaking/what-is-multilingual-testimonial-production/,50.0,strong,6,"multilingual video, multiple languages, global audience, subtitle, caption, translation tool",,What Is Multilingual Testimonial Production,"rs are more likely to believe and act upon stories delivered in their native tongue.  Additionally, multilingual videos often get more traction on social media, where users organically share content t",multilingual video translation,"Strong fit — 6 relevant keywords found: multilingual video, multiple languages, global audience, subtitle, caption. Content discusses topics where a video translator link adds value.",1007
wowto.ai,https://wowto.ai/blog/how-to-create-a-content-localization-strategy-for-customer-education,49.0,medium,4,"multiple languages, translate content, content localization, global audience",,Content Localization Strategy for Customer Education,"increased revenue opportunities. For instance, a SaaS company offering localized product guides in multiple languages can cater to diverse industries and regions, positioning itself as a truly global ",AI video translator for global audiences,"Medium fit — 4 relevant keywords found: multiple languages, translate content, content localization, global audience.",1094
growth-engines.com,https://growth-engines.com/insights/branding/maintaining-consistent-brand-identity-across-digital-markets,49.0,strong,0,,,Consistent Brand Identity Across Digital Markets,,AI video translator,COMPETITOR OPPORTUNITY: Page mentions a competitor. Pitch replacing or adding Synthesia alongside. Article mentions competitors and has limited fit for video translator link.,1021
bluecarrot.io,https://bluecarrot.io/blog/how-to-develop-multilingual-e-learning-videos-8-steps-to-global-success/,49.0,strong,6,"dub, dubbing, multiple languages, content localization, global audience, subtitle",,8 Steps to Develop Multilingual E-Learning Video Content,ng video content requires careful planning and execution. It goes beyond simply adding subtitles or dubbing existing videos. This article presents a comprehensive guide outlining eight essential steps,AI video translator for global audiences,"Strong fit — 6 relevant keywords found: dub, dubbing, multiple languages, content localization, global audience. Content discusses topics where a video translator link adds value.",569
supertone.ai,https://www.supertone.ai/en/work/global-content-my-voice-ai-23-languages,49.0,strong,5,"dub, dubbing, ai dubbing, voice cloning, multilingual content",,Complete Guide to AI Voice Cloning in 23 Languages,"0d5e61c486b5_%EC%97%85%EB%8D%B0%EC%9D%B4%ED%8A%B8_ko.png)](https://www.supertone.ai/en/work/play-ai-dubbing-usability-update)[January 26, 2026\\ \\ Play New Update: AI Dubbing and Usability Improvemen",AI video dubbing and translation,"Strong fit — 5 relevant keywords found: dub, dubbing, ai dubbing, voice cloning, multilingual content. Content discusses topics where a video translator link adds value.",697
ssojet.com,https://ssojet.com/blog/video-translation-for-sso-training,49.0,strong,8,"video translation, dub, dubbing, multilingual video, multilingual training, global workforce, non-english, subtitle",,How Video Translation Enhances Multilingual User Training,# How Video Translation Enhances Multilingual User Training for SSO and Access Management Systems  Cybersecurity  IAM  SSO  Localization  Enterprise Training  Tech   ![Andre,AI video translator,"Strong fit — 8 relevant keywords found: video translation, dub, dubbing, multilingual video, multilingual training. Content discusses topics where a video translator link adds value.",1102
storykit.io,https://storykit.io/blog/repurpose-video-content,48.0,weak,1,repurpose video,,5 ways to repurpose video content,"/category)  /  [Video Creation Tips](https://storykit.io/category/video-creation-tips)  # 5 ways to repurpose video content  Jonna Ekman  \|  January 17, 2022  February 18, 2025  ![An endless way of m",,Weak fit — only 1 relevant keyword(s): repurpose video.,742
veracontent.com,https://veracontent.com/mix/global-content-strategy/,47.0,medium,3,"multiple languages, global audience, multilingual content",Bridget Langer,Creating a global content strategy,"and culture.  **Global content strategies outline a framework for creating and managing content in multiple languages and regions**. They cover more than content planning but things like governance, u",AI video translator for global audiences,"Medium fit — 3 relevant keywords found: multiple languages, global audience, multilingual content.",959
xtm.ai,https://xtm.ai/blog/content-localization,47.0,medium,4,"content localization, international audience, subtitle, global teams",Grace Cowan,Everything you need to know about content localization,"- [XTM Blog](https://xtm.ai/blog) - Everything you need to know about content localization  October 21, 2025[Translation management](https://xtm.ai/blog/tag/translation-management)  # Everything you n",AI video translator for global audiences,"Medium fit — 4 relevant keywords found: content localization, international audience, subtitle, global teams.",923
pixeltable.com,https://www.pixeltable.com/blog/automated-video-translation-voiceover-pipeline,47.0,medium,4,"video translation, video localization, multilingual video, multiple languages",,Automated Video Translation Pipeline,erimentation Loop](https://www.pixeltable.com/blog/iterate-on-data-not-infrastructure)  ![Automated Video Translation Pipeline: From Audio Transcription to Multilingual Voiceover in Minutes](https://w,AI video translator,"Medium fit — 4 relevant keywords found: video translation, video localization, multilingual video, multiple languages.",682
schoolmaker.com,https://schoolmaker.com/blog/ai-online-course-creator,45.0,excluded_already_mentioned,1,multiple languages,,12 Best AI Online Course Creators in 2026,"ng quizzes and assessment questions - Producing voiceovers and narration - Translating content into multiple languages  The best AI course creators don't just automate, they collaborate with you. They",Synthesia video translator,SYNTHESIA MENTIONED: Page already mentions Synthesia but may not link to the video translator page specifically. Pitch adding a direct link to the translator feature. Synthesia is already mentioned in,536
shootsta.com,https://shootsta.com/blog/video-content-localization-global-markets/,45.0,strong,8,"video translation, video localization, dub, dubbing, content localization, global audience, international audience, subtitle","Mark AshworthJuly 9, 2025",Video Content Localization for Global Markets,es production efficiency with cultural fit.  ## Translation and Linguistic Adaptation  Professional video translation needs specialized audiovisual skills. Translators must think about more than word ,AI video translator,"Strong fit — 8 relevant keywords found: video translation, video localization, dub, dubbing, content localization. Content discusses topics where a video translator link adds value.",1032
bizky.ai,https://bizky.ai/blog/employee-engagement-in-global-remote-teams/,45.0,weak,1,global workforce,,Employee Engagement in Global Remote Teams,nt regions allows organizations to tailor interventions and ensure consistent motivation across the global workforce.  | Challenge | Solution | | --- | --- | | Lack of face-to-face interaction | Regul,,Weak fit — only 1 relevant keyword(s): global workforce.,968
emptrust.com,https://www.emptrust.com/multilingual-onboarding-the-art-of-driving-employee-engagement-with-translated-material/,44.0,medium,3,"multiple languages, translate training, multilingual onboarding",,Multilingual Onboarding: Driving Employee Engagement,"ransition for newcomers.  3. **Multilingual Orientation Sessions**: Conduct orientation sessions in multiple languages to provide a comprehensive understanding of company policies, procedures, and exp",translate training videos into multiple languages,"Medium fit — 3 relevant keywords found: multiple languages, translate training, multilingual onboarding.",822
taia.io,https://taia.io/resources/blog/localization-trends-future-global-communication/,44.0,strong,11,"dub, dubbing, ai dubbing, voice cloning, lip-sync, multilingual video, localize content, international audience",,Top 5 Localization Trends in 2026,ear-perfect speech-to-text transcription in 100+ languages - **AI voice cloning** creates realistic dubbing using synthesized voices (though quality still lags professional voice actors for brand-crit,multilingual video translation,"Strong fit — 11 relevant keywords found: dub, dubbing, ai dubbing, voice cloning, lip-sync. Content discusses topics where a video translator link adds value.",1002
birdeatsbug.com,https://birdeatsbug.com/blog/video-captioning-best-practices,43.0,medium,3,"subtitle, caption, video accessibility",,15 Video Captioning Best Practices,gh-Quality Captions](https://birdeatsbug.com/blog/video-captioning-best-practices#) - [Captions vs. Subtitles vs. Transcripts: Key Differences Explained](https://birdeatsbug.com/blog/video-captioning-,AI video translator,"Medium fit — 3 relevant keywords found: subtitle, caption, video accessibility.",966
interprenet.net,https://interprenet.net/multilingual-subtitling,43.0,weak,2,"global audience, subtitle",,Multilingual Subtitling Services,.net/hs-fs/hubfs/2023/decoration-images/Ellipse%2031.png?length=300&name=Ellipse%2031.png)  Reach a global audience with subtitles in any language   Reach a wider audience with your videos thanks to o,,"Weak fit — only 2 relevant keyword(s): global audience, subtitle.",550
lipdub.ai,https://www.lipdub.ai/blogs/marketing-localization,42.0,strong,9,"translate video, video translation, video localization, localize video, dub, dubbing, lip sync, lip-sync",,Marketing Localization: 7 Best Practices,"tter too—layout, colors, imagery, and even iconography may need adjustment. With LipDub AI, you can translate video dialogue while preserving the original emotion and performance, so the final product",AI video translator,"Strong fit — 9 relevant keywords found: translate video, video translation, video localization, localize video, dub. Content discusses topics where a video translator link adds value.",955
coffeepals.com,https://www.coffeepals.com/blog/how-to-make-collaboration-work-across-time-zones-and-global-teams,42.0,weak,1,global teams,,Collaboration Across Time Zones and Global Teams,# How to Make Collaboration Work Across Time Zones and Global Teams  ![](https://cdn.prod.website-files.com/64ef86fd99a286b447305635/6662830b0e5da52c126b5d95_649edc978c6e79defe277b26_Logo%2525206.webp,,Not an article — too short or not editorial content. [Reclassified: was not_article but has some keyword signals],215
exemplary.ai,https://exemplary.ai/en/blog/repurpose-webinar-content,42.0,weak,2,"global audience, subtitle",,12+ Smart ways to repurpose your webinar,"(in SRT format) ensures that non-native speakers can follow along easily. This opens the door to a global audience, helping you reach people across different regions and languages and improves searcha",,"Weak fit — only 2 relevant keyword(s): global audience, subtitle.",1109
jrlanguage.com,https://jrlanguage.com/blog/elearning-translation-essential-best-practices-for-a-global-audience/,41.0,medium,3,"video localization, global audience, international audience",including eLearning translation services,eLearning Translation: Essential Best Practices,"e presence of on-screen text on videos adds to the videos’ comprehension but adds complexity to the video localization. So, plan to have the source files of your",AI video localization tool,"Medium fit — 3 relevant keywords found: video localization, global audience, international audience.",1100
mytonomy.com,https://www.mytonomy.com/blog/digital-patient-education-microlearning-guide-for-health-systems,41.0,no_fit,0,,,Digital Patient Education Microlearning Guide,,,No relevant keywords found — article topic doesn't relate to video translation use cases.,371
omniplexlearning.com,https://omniplexlearning.com/blog/whats-new-in-ld-trends-you-cant-ignore-in-2026/,41.0,no_fit,0,,,L&D Trends you can't ignore in 2026,,,No relevant keywords found — article topic doesn't relate to video translation use cases.,569
filmgrail.com,https://filmgrail.com/blog/how-to-localize-video-content-for-global-audiences/,41.0,strong,7,"video localization, localize video, dub, dubbing, global audience, subtitle, caption",,How to Localize Video Content for Global Audiences,"does it matter? Studies show **72.4% of consumers prefer buying in their native language**, and the video localization market is expected to reach **$3.05 billion by 2027**.  Here’s the quick guide:  ",AI video localization tool,"Strong fit — 7 relevant keywords found: video localization, localize video, dub, dubbing, global audience. Content discusses topics where a video translator link adds value.",1088
assimasolutions.com,https://assimasolutions.com/resources/blog/why-traditional-onboarding-fails-for-global-teams-and-what-to-do-about-it/,41.0,strong,5,"translate training, multilingual training, multilingual onboarding, global workforce, global teams",,Multilingual Onboarding Challenges,"arding programs come with certain hurdles, which include:  ### Language Barriers  Since you need to translate training from the language the learning materials were created in, to the languages they a",translate training videos into multiple languages,"Strong fit — 5 relevant keywords found: translate training, multilingual training, multilingual onboarding, global workforce, global teams. Content discusses topics where a video translator link adds ",889
techclass.com,https://www.techclass.com/resources/learning-and-development-articles/multi-language-member-training-reaching-a-diverse-audience,41.0,weak,0,,,Multi-Language Member Training,,,"Not an article — too short or not editorial content. [Reclassified: was not_article, keeping as weak — may be scrape issue]",22
globalinterpreting.com,https://globalinterpreting.com/blog/patient-education-materials-ensuring-accessibility-for-lep-populations/,40.0,no_fit,0,,,Patient Education Materials: Accessibility for LEP,,,No relevant keywords found — article topic doesn't relate to video translation use cases.,918
storiesincorporated.com,https://storiesincorporated.com/best-employer-branding-videos/,40.0,no_fit,0,,,Best Employer Branding Videos: Ultimate List,,,No relevant keywords found — article topic doesn't relate to video translation use cases.,1022
ititranslates.com,https://ititranslates.com/navigating-dei-changes-what-it-means-for-language-services/,40.0,no_fit,0,,,DEI Changes: What it Means for Language Services,,,No relevant keywords found — article topic doesn't relate to video translation use cases.,695
enterprisetube.com,https://enterprisetube.com/blog/learning-and-development,40.0,no_fit,0,,,Learning and Development: Video-Based Workforce Training,,,No relevant keywords found — article topic doesn't relate to video translation use cases.,1037
vatis.tech,https://vatis.tech/blog/how-to-translate-youtube-videos-your-easy-guide,40.0,strong,5,"multiple languages, global audience, subtitle, caption, translation tool",,How to Translate YouTube Videos: Easy Guide,")  3. **Translate Your File**: Once the video transcription is complete, choose from any of the 30+ multiple languages supported to translate your file.  ![how to translate youtube videos with Vatis T",AI video translator for global audiences,"Strong fit — 5 relevant keywords found: multiple languages, global audience, subtitle, caption, translation tool. Content discusses topics where a video translator link adds value.",745
adverbum.com,https://www.adverbum.com/post/best-ai-translation-tools-in-2026-ranked-8,40.0,weak,1,translation tool,,Top 8 Best AI Translation Tools 2026,top of page  Skip to Main Content  Search  ![Team collaborating on AI translation tools in modern office](https://csuxjmfbwmkxiegfpljm.supabase.co/storage/v1/object/public/blog-images/organization-964,,Weak fit — only 1 relevant keyword(s): translation tool.,880
interproinc.com,https://www.interproinc.com/3-reasons-why-elearning-translation-is-important-for-manufacturers/,40.0,weak,2,"translate training, global workforce",,eLearning Translation: Boosting Global Workforce Skills,"ce. Take it from us – training is not the area to skimp on by relying on your own employees to help translate training materials.  With a global workforce, training programs must be conducted in a mul",,"Weak fit — only 2 relevant keyword(s): translate training, global workforce.",775
ehscareers.com,https://ehscareers.com/employer-blog/multilingual-safety-programs-beyond-google-translate/,40.0,weak,1,translation tool,,Multilingual Safety Programs: Beyond Google Translate,"reers.com/employer-blog/2025/10/08/) - 8:42 am  Effective workplace safety requires more than basic translation tools; professional services ensure clear, culturally relevant communication to protect ",,Weak fit — only 1 relevant keyword(s): translation tool.,986
marketbetter.ai,https://www.marketbetter.ai/blog/best-ai-video-tools-sales-teams-2026/,39.0,no_fit,0,,,Best AI Video Tools for Sales Teams in 2026,,,No relevant keywords found — article topic doesn't relate to video translation use cases.,975
ottolearn.com,https://www.ottolearn.com/post/111-simplify-multilingual-content-with-the-right-microlearning-platform,39.0,strong,5,"multiple languages, translate content, multilingual training, global audience, multilingual content",,Simplify Multilingual Content with Microlearning Platform,_day.png)  ## Large organizations may have a global audience of diverse learners who speak and read multiple languages.  Or all the employees might be located in one country but have a variety of nati,translate training videos into multiple languages,"Strong fit — 5 relevant keywords found: multiple languages, translate content, multilingual training, global audience, multilingual content. Content discusses topics where a video translator link adds",1075
weet.co,https://weet.co/blog/knowledge-base-video-everything-you-need-to-know,39.0,weak,1,caption,"Florence on August 12, 2025",Knowledge Base Video: Everything You Need to Know,"a person can watch and do the task in the same sitting. And they’re easy to scan, with chapters and captions that make it simple to jump to the exact step a person needs.  Organizations use KB videos ",,Weak fit — only 1 relevant keyword(s): caption.,1103
ivannovation.com,https://ivannovation.com/blog/how-to-translate-videos/,38.0,strong,7,"translate video, video translation, video localization, localize video, global audience, subtitle, caption",Guest,How to Translate Videos: Step-by-Step Guide,o closeSearch  [Close Search](https://ivannovation.com/blog/how-to-translate-videos/#)  ![videotape translate video](https://ivannovation.com/wp-content/uploads/2020/11/videotape-translate-video.jpg) ,AI video translator,"Strong fit — 7 relevant keywords found: translate video, video translation, video localization, localize video, global audience. Content discusses topics where a video translator link adds value.",1000
atlantictraining.com,https://www.atlantictraining.com/blog/multilingual-safety-training-companies/,38.0,weak,0,,Industry,Multilingual Safety Training Companies: Top 5,,,"Not an article — too short or not editorial content. [Reclassified: was not_article, keeping as weak — may be scrape issue]",287
multilingualconnections.com,https://multilingualconnections.com/blog/the-power-of-translation-in-building-a-more-inclusive-workplace-culture/,37.0,no_fit,0,,,Translation in Building Inclusive Workplace Culture,,,No relevant keywords found — article topic doesn't relate to video translation use cases.,1067
deephow.com,https://deephow.com/blog/8-expert-tips-for-video-training,37.0,no_fit,0,,,8 expert tips for creating video training for skilled workforce,,,No relevant keywords found — article topic doesn't relate to video translation use cases.,967
goodmanlantern.com,https://goodmanlantern.com/blog/enterprise-content-marketing-strategy/,37.0,weak,1,caption,,Scalable Content Marketing Strategy,"when it comes to enterprises, the game changes. You’re not just creating blog posts or social media captions; you’re building a scalable enterprise content marketing machine that aligns with business ",,Weak fit — only 1 relevant keyword(s): caption.,925
longstories.ai,https://longstories.ai/blog/ai-vs-manual-video-production-cost-comparison,37.0,weak,1,caption,,AI vs Manual Video Production: Cost Comparison,"fering:  - Automated editing tools - Access to royalty-free music and footage libraries - Automated captioning and voiceover generation - Quick revisions without added costs  For instance, AI can anal",,Weak fit — only 1 relevant keyword(s): caption.,1116
transyncai.com,https://www.transyncai.com/blog/how-to-translate-youtube-video-to-english/,36.0,medium,3,"subtitle, caption, translation tool",Jun Chen,How to Translate YouTube Video to English,"ws is, in 2025, there are several smart ways to translate YouTube videos to English — from built-in subtitle tools to advanced **AI-powered translators** like **Transync AI**. Let’s explore how you ca",AI video translator,"Medium fit — 3 relevant keywords found: subtitle, caption, translation tool.",930
truefan.ai,https://www.truefan.ai/blogs/content-localization-ultimate-guide-2025,36.0,weak,1,content localization,,Ultimate 2025 Guide to Content Localization Strategy,)/Ultimate 2025 Guide to Content Localizat...  # Beyond Translation: The Ultimate Guide to Flawless Content Localization in 2025  Estimated reading time: 12 minutes  ![Ultimate 2025 Guide to Content L,,Weak fit — only 1 relevant keyword(s): content localization.,1176
astlanguage.com,https://www.astlanguage.com/blog/how-multilingual-training-benefits-organisations-dei-efforts/,35.0,medium,4,"multiple languages, multilingual training, global workforce, non-english",,How Multilingual Training Benefits DEI Efforts,/) serves as a powerful tool for advancing DEI within organisations. Offering training materials in multiple languages fosters inclusivity by ensuring equal access to information and resources through,translate training videos into multiple languages,"Medium fit — 4 relevant keywords found: multiple languages, multilingual training, global workforce, non-english.",651
